{
  "record_type": "decision_record_v2",
  "schema_version": "2.0.0",
  "decision_id": "DR-V2-ELEMENT-SVG-001",
  "decision_family_id": "element_choice.image_svg_background",
  "resolver_status": "conditional",
  "evidence_tier": "official_docs",
  "rule_id": "KROAD-003-SCHEMA-BOOTSTRAP",
  "rule_version": "1.0.0",
  "decision_type": "resolver_derived",
  "trigger_source": "initial_decision",
  "provisional_status": {
    "is_provisional": true,
    "reason": "official documentation can support documented capability only; project/runtime evidence is still missing",
    "missing_evidence": [
      "project_export",
      "runtime_browser"
    ],
    "blocks_final_release": true
  },
  "reopen_count": 0,
  "max_reopen_count": 3,
  "previous_decision_ref": null,
  "requires_reaudit": true,
  "selected_option": {
    "option_id": "v4.svg",
    "label": "SVG"
  },
  "allowed_options": [
    {
      "option_id": "v4.svg",
      "label": "SVG"
    },
    {
      "option_id": "v4.image",
      "label": "Image"
    },
    {
      "option_id": "background_image",
      "label": "Background image"
    }
  ],
  "rejected_options": [
    {
      "option_id": "background_image",
      "reason": "decorative vector asset is not a background-layer decision in this fixture"
    }
  ],
  "forbidden_options": [
    {
      "option_id": "v3.widget_fallback",
      "reason": "V3 fallback is not a valid V4 design target"
    }
  ],
  "evidence_refs": [
    {
      "evidence_id": "EV-OFFICIAL-DOCS-SVG-CAPABILITY-001",
      "evidence_tier": "official_docs",
      "source_type": "official_elementor_docs",
      "ref": "kernel/official-sources/elementor-v4-source-manifest.v0.json",
      "limitations": [
        "documents platform/editor capability only",
        "does not prove target project availability",
        "does not prove runtime rendering"
      ]
    }
  ],
  "forbidden_overclaims": [
    "official_docs_do_not_prove_project_availability",
    "official_docs_do_not_prove_runtime_behavior",
    "schema_valid_does_not_prove_semantic_correctness",
    "decision_record_v2_does_not_prove_builder_execution",
    "decision_record_v2_does_not_prove_production_readiness"
  ],
  "downstream_owner": "architect",
  "notes": [
    "Fixture is schema/validator evidence only; it is not target-project evidence."
  ]
}
